{
  "contains_debug_data": false,
  "contains_solutions": true,
  "hint_plans_by_puzzle_id": {
    "puz_0200446e708184d4": [
      {
        "kind": "room_focus",
        "message": "Room 1 must contain exactly 3 shaded cell(s).",
        "room_id": 0
      },
      {
        "cell": [
          0,
          0
        ],
        "kind": "reveal_cell",
        "message": "Cell [0, 0] is part of the solution."
      },
      {
        "kind": "drop_preview",
        "message": "Preview the rigid stone fall to see whether the bottom half fills cleanly."
      }
    ],
    "puz_2a1ad01590fefb51": [
      {
        "kind": "room_focus",
        "message": "Room 1 must contain exactly 2 shaded cell(s).",
        "room_id": 0
      },
      {
        "cell": [
          0,
          0
        ],
        "kind": "reveal_cell",
        "message": "Cell [0, 0] is part of the solution."
      },
      {
        "kind": "drop_preview",
        "message": "Preview the rigid stone fall to see whether the bottom half fills cleanly."
      }
    ],
    "puz_2b865a62290f27d8": [
      {
        "kind": "tutorial",
        "message": "Use room numbers as exact shaded-cell counts before testing the full drop."
      },
      {
        "kind": "room_focus",
        "message": "Room 2 must contain exactly 2 shaded cell(s).",
        "room_id": 1
      },
      {
        "cell": [
          0,
          0
        ],
        "kind": "reveal_cell",
        "message": "Cell [0, 0] is part of the solution."
      },
      {
        "kind": "drop_preview",
        "message": "Preview the rigid stone fall to see whether the bottom half fills cleanly."
      }
    ],
    "puz_2e3d360bc17a6ca3": [
      {
        "kind": "tutorial",
        "message": "Shaded cells may touch inside a room, but they cannot touch across a room border."
      },
      {
        "kind": "room_focus",
        "message": "Room 1 must contain exactly 2 shaded cell(s).",
        "room_id": 0
      },
      {
        "cell": [
          0,
          0
        ],
        "kind": "reveal_cell",
        "message": "Cell [0, 0] is part of the solution."
      },
      {
        "kind": "drop_preview",
        "message": "Preview the rigid stone fall to see whether the bottom half fills cleanly."
      }
    ],
    "puz_4447728eeb571ca5": [
      {
        "kind": "room_focus",
        "message": "Room 1 must contain exactly 3 shaded cell(s).",
        "room_id": 0
      },
      {
        "cell": [
          0,
          1
        ],
        "kind": "reveal_cell",
        "message": "Cell [0, 1] is part of the solution."
      },
      {
        "kind": "drop_preview",
        "message": "Preview the rigid stone fall to see whether the bottom half fills cleanly."
      }
    ],
    "puz_6898de6a87b363f7": [
      {
        "kind": "room_focus",
        "message": "Room 2 must contain exactly 1 shaded cell(s).",
        "room_id": 1
      },
      {
        "cell": [
          0,
          1
        ],
        "kind": "reveal_cell",
        "message": "Cell [0, 1] is part of the solution."
      },
      {
        "kind": "drop_preview",
        "message": "Preview the rigid stone fall to see whether the bottom half fills cleanly."
      }
    ],
    "puz_696e00ffe18a47d7": [
      {
        "kind": "room_focus",
        "message": "Room 3 must contain exactly 2 shaded cell(s).",
        "room_id": 2
      },
      {
        "cell": [
          0,
          1
        ],
        "kind": "reveal_cell",
        "message": "Cell [0, 1] is part of the solution."
      },
      {
        "kind": "drop_preview",
        "message": "Preview the rigid stone fall to see whether the bottom half fills cleanly."
      }
    ],
    "puz_73ab64a0a4557e0b": [
      {
        "kind": "room_focus",
        "message": "Room 1 must contain exactly 3 shaded cell(s).",
        "room_id": 0
      },
      {
        "cell": [
          0,
          0
        ],
        "kind": "reveal_cell",
        "message": "Cell [0, 0] is part of the solution."
      },
      {
        "kind": "drop_preview",
        "message": "Preview the rigid stone fall to see whether the bottom half fills cleanly."
      }
    ],
    "puz_92608610d2afe3da": [
      {
        "kind": "tutorial",
        "message": "Shade a connected shape inside each numbered room, then check how the stones fall."
      },
      {
        "kind": "room_focus",
        "message": "Room 2 must contain exactly 1 shaded cell(s).",
        "room_id": 1
      },
      {
        "cell": [
          0,
          0
        ],
        "kind": "reveal_cell",
        "message": "Cell [0, 0] is part of the solution."
      },
      {
        "kind": "drop_preview",
        "message": "Preview the rigid stone fall to see whether the bottom half fills cleanly."
      }
    ],
    "puz_9aaf25bd61b78ad4": [
      {
        "kind": "room_focus",
        "message": "Room 1 must contain exactly 4 shaded cell(s).",
        "room_id": 0
      },
      {
        "cell": [
          0,
          3
        ],
        "kind": "reveal_cell",
        "message": "Cell [0, 3] is part of the solution."
      },
      {
        "kind": "drop_preview",
        "message": "Preview the rigid stone fall to see whether the bottom half fills cleanly."
      }
    ],
    "puz_bc8a91d0f4c4c5a5": [
      {
        "kind": "room_focus",
        "message": "Room 1 must contain exactly 1 shaded cell(s).",
        "room_id": 0
      },
      {
        "cell": [
          0,
          0
        ],
        "kind": "reveal_cell",
        "message": "Cell [0, 0] is part of the solution."
      },
      {
        "kind": "drop_preview",
        "message": "Preview the rigid stone fall to see whether the bottom half fills cleanly."
      }
    ],
    "puz_ced86e183b9540bf": [
      {
        "kind": "room_focus",
        "message": "Room 1 must contain exactly 4 shaded cell(s).",
        "room_id": 0
      },
      {
        "cell": [
          0,
          0
        ],
        "kind": "reveal_cell",
        "message": "Cell [0, 0] is part of the solution."
      },
      {
        "kind": "drop_preview",
        "message": "Preview the rigid stone fall to see whether the bottom half fills cleanly."
      }
    ],
    "puz_ec816afd75d59b41": [
      {
        "kind": "room_focus",
        "message": "Room 1 must contain exactly 4 shaded cell(s).",
        "room_id": 0
      },
      {
        "cell": [
          0,
          1
        ],
        "kind": "reveal_cell",
        "message": "Cell [0, 1] is part of the solution."
      },
      {
        "kind": "drop_preview",
        "message": "Preview the rigid stone fall to see whether the bottom half fills cleanly."
      }
    ],
    "puz_f50910387398e55a": [
      {
        "kind": "room_focus",
        "message": "Room 4 must contain exactly 3 shaded cell(s).",
        "room_id": 3
      },
      {
        "cell": [
          0,
          1
        ],
        "kind": "reveal_cell",
        "message": "Cell [0, 1] is part of the solution."
      },
      {
        "kind": "drop_preview",
        "message": "Preview the rigid stone fall to see whether the bottom half fills cleanly."
      }
    ]
  },
  "manifest": {
    "categories": {
      "easy": 5,
      "medium": 5,
      "showcase": 1,
      "tutorial": 3
    },
    "description": "Local MVP starter puzzles for the StoStone Godot app.",
    "puzzle_count": 14,
    "schema_major": 1,
    "solution_data_notice": "SolutionDTO data is local-MVP/dev convenience data only and is not valid for competitive, paid, rewarded, or server-authoritative modes.",
    "title": "StoStone Starter Pack"
  },
  "pack_id": "starter_pack",
  "pack_type": "local_mvp",
  "puzzles_by_id": {
    "puz_0200446e708184d4": {
      "canonical_hash": "0200446e708184d4154b9ab57e23bcffb03ae811b64a127ab76a1358dad5548d",
      "category": "easy",
      "cols": 4,
      "difficulty": {
        "family": "4x4-4r",
        "label": "Easy",
        "scale": "source-label",
        "score": null,
        "solve_iterations": null
      },
      "initial_state": [],
      "layout": [
        [
          0,
          0,
          1,
          1
        ],
        [
          0,
          2,
          1,
          1
        ],
        [
          2,
          2,
          1,
          3
        ],
        [
          3,
          3,
          3,
          3
        ]
      ],
      "metadata": {},
      "puzzle_id": "puz_0200446e708184d4",
      "rooms": 4,
      "rows": 4,
      "ruleset": "sto-stone",
      "ruleset_version": "1.0",
      "schema_version": "1.0.0",
      "source": {
        "author": null,
        "comment": null,
        "kind": "puzpre",
        "path": "C:\\Users\\xtrem\\OneDrive\\Documents\\codecraft\\StoStoneSolver\\puzzles\\162-002.txt"
      },
      "title": "Small Steps",
      "unique_solution_proof": {
        "constraint_checks": 1,
        "elapsed_seconds": 0.000199,
        "is_unique": true,
        "mode": "sto-stone",
        "search_limit": 2,
        "solution_count": 1
      },
      "weights": [
        {
          "cell": [
            0,
            0
          ],
          "room_id": 0,
          "value": 3
        },
        {
          "cell": [
            0,
            2
          ],
          "room_id": 1,
          "value": 1
        },
        {
          "cell": [
            2,
            0
          ],
          "room_id": 2,
          "value": 1
        }
      ]
    },
    "puz_2a1ad01590fefb51": {
      "canonical_hash": "2a1ad01590fefb515ef5ba7b1518ad4217bf962ce07bcfd90ea36ca86cfeaab3",
      "category": "easy",
      "cols": 4,
      "difficulty": {
        "family": "4x4-4r",
        "label": "Easy",
        "scale": "calibrated",
        "score": 28.037125007211564,
        "solve_iterations": 2
      },
      "initial_state": [],
      "layout": [
        [
          0,
          0,
          1,
          1
        ],
        [
          0,
          0,